<?xml version="1.0"?>
<xs:schema xmlns:xs="http://www.w3.org/2001/XMLSchema">

  <xs:element name="konyvek">
    <xs:complexType>
      <xs:sequence>
        <xs:element name="konyvek" minOccurs="0" maxOccurs="unbounded">
          <xs:complexType>
            <xs:sequence>
              <xs:element type="xs:string" name="cim"/>
                <xs:element type="xs:string" name="szerzo"/>
                  <xs:element name="szereplo" minOccurs="0" maxOccurs="unbounded">
                    <xs:complexType>
                      <xs:sequence>
                        <xs:element type="xs:string" name="nev"/>
                        <xs:element type="xs:string" name="baratja"/>
                        <xs:element type="xs:string" name="szuletett"/>
                        <xs:element type="xs:string" name="jellemzes"/>
                      </xs:sequence>
                  </xs:complexType> 
                </xs:element>
              </xs:sequence>
            <xs:attribute name="isbn" type="xs:string"/> 
          </xs:complexType>
        </xs:element>
      </xs:sequence>
    </xs:complexType>
  </xs:element>
</xs:schema> 
