<?xml version="1.0" encoding="UTF-8"?>

<konyvek xmlns:xs="http://w3.org/2001/XMLSchema-instance" xs:noNamespaceSchemaLocation="HA_Dogworld.xsd">
    <konyv isbn="08361217462">
        <cim>DogWorld</cim>
        <szerzo>Charles M. Schulz</szerzo>

        <szereplo>
            <nev>Snoopy</nev>
            <baratja>Patty</baratja>
            <szuletett>2010-10-04</szuletett>
            <jellemzes>extroveltalt beagle</jellemzes>
        </szereplo>

        <szereplo>
            <nev>Patty</nev>
            <szuletett>2011-08-22</szuletett>
            <jellemzes>vakmero, leany</jellemzes>
        </szereplo>

    </konyv>
</konyvek>
